TAG,DESCRIÇÃO,ENTRADA,SAÍDA,SEVERIDADE,ALARME,Invertido,,,
I723DFH3001,RELAÇÃO AR/COMBUSTÍVEL,BAIXO,NORMALIZADO,ALTA,SIM,SIM,,,
I722DFH3004,DIFER FLUXO SAÍDA ECO/ÁGUA ALIMENTAÇÃO,ALTO,NORMALIZADO,MEDIA,SIM,NÃO,,,
I722DLH3001,NÍVEL VASO SEPARADOR - MONITORAÇÃO,DISCREPANCIA,NORMALIZADO,MEDIA,SIM,NÃO,,,
I722DPH3014,PRESSÃO DIF FILTRO ADM BBA RECIRC CALDEIRA,ALTO,NORMALIZADO,MEDIA,SIM,NÃO,,,
I722DPHH3015,PRESSÃO DIF FILTRO ADM BBA RECIRC CALDEIRA,MUITO ALTO,NORMALIZADO,ALTA,SIM,NÃO,,,
I722DPL3017,PRESSÃO DIF BBA RECIRCULAÇÃO CALDEIRA,BAIXO,NORMALIZADO,MEDIA,SIM,NÃO,,,
I722DPLL3018,PRESSÃO DIF BBA RECIRCULAÇÃO CALDEIRA,MUITO BAIXO,NORMALIZADO,ALTA,SIM,NÃO,,,
I722DTH3336,MONITORAÇÃO TEMP VAPOR SAÍDA EVAP LE,DISCREPANCIA,NORMALIZADO,MEDIA,SIM,NÃO,,,
I722DTH3345,MONITORAÇÃO TEMP VAPOR SAÍDA EVAP LD,DISCREPANCIA,NORMALIZADO,MEDIA,SIM,NÃO,,,
I722DTH3373,VÁLVULA A22ESM2088 - NÃO COMPLETAMENTE FECHADA (A22DTSH3373),,,,,,,,
I722DTH3374,VÁLVULA A22ESM2087 - NÃO COMPLETAMENTE FECHADA (A22DTSH3374),,,,,,,,
I722DTH3413,MONITORAÇÃO TEMP VAPOR ENTR SH2 LE,DISCREPANCIA,NORMALIZADO,MEDIA,SIM,NÃO,,,
I722DTH3416,MONITORAÇÃO TEMP VAPOR ENTR SH2 LD,DISCREPANCIA,NORMALIZADO,MEDIA,SIM,NÃO,,,
I722DTH3419,MONITORAÇÃO TEMP VAPOR SAÍDA SH2 LE,DISCREPANCIA,NORMALIZADO,MEDIA,SIM,NÃO,,,
I722DTH3422,MONITORAÇÃO TEMP VAPOR SAÍDA SH2 LD,DISCREPANCIA,NORMALIZADO,MEDIA,SIM,NÃO,,,
I722DTH3426,MONITORAÇÃO TEMP VAPOR ENTR SH3 LE,DISCREPANCIA,NORMALIZADO,MEDIA,SIM,NÃO,,,
I722DTH3429,MONITORAÇÃO TEMP VAPOR ENTR SH3 LD,DISCREPANCIA,NORMALIZADO,MEDIA,SIM,NÃO,,,
I722DTH3533,MONITORAÇÃO TEMP VAPOR ENTR RH1 LE,DISCREPANCIA,NORMALIZADO,MEDIA,SIM,NÃO,,,
I722DTH3536,MONITORAÇÃO TEMP VAPOR ENTR RH1 LD,DISCREPANCIA,NORMALIZADO,MEDIA,SIM,NÃO,,,
I722DTH3539,MONITORAÇÃO TEMP VAPOR SAÍDA RH1 LE,DISCREPANCIA,NORMALIZADO,MEDIA,SIM,NÃO,,,
I722DTH3546,MONITORAÇÃO TEMP VAPOR SAÍDA RH1 LD,DISCREPANCIA,NORMALIZADO,MEDIA,SIM,NÃO,,,
I722DTH3554,MONITORAÇÃO TEMP VAPOR ENTR RH2 LE,DISCREPANCIA,NORMALIZADO,MEDIA,SIM,NÃO,,,
I722DTH3557,MONITORAÇÃO TEMP VAPOR ENTR RH2 LD,DISCREPANCIA,NORMALIZADO,MEDIA,SIM,NÃO,,,
I722DTLL3366,DIF TEMP ADM BBA RECIRC CALD/ÁGUA ALIM,MUITO BAIXO,NORMALIZADO,MEDIA,SIM,NÃO,,,
I722EMD1002,BOMBA 1 RECUPERAÇÃO DRENOS CALDEIRA,DESLIGADA,LIGADA,BAIXA,NÃO,NÃO,,,
I722EMD1003,BOMBA 2 RECUPERAÇÃO DRENOS CALDEIRA,DESLIGADA,LIGADA,BAIXA,NÃO,NÃO,,,
I722EMD3001,BOMBA RECIRCULAÇÃO CALDEIRA,DESLIGADA,LIGADA,BAIXA,NÃO,NÃO,,,
I722EMD3701,UNID HIDR VVAS SEGURANÇA RH,DESLIGADA,LIGADA,BAIXA,NÃO,NÃO,,,
I722EMD3702,UNID HIDR VVAS PARTIDA,DESLIGADA,LIGADA,BAIXA,NÃO,NÃO,,,
I722EMD3801,UNID HIDR BYPASS TURBINA AP,DESLIGADA,LIGADA,BAIXA,NÃO,NÃO,,,
I722EME3701,OPERAÇÃO UNID HIDR VVAS SEGURANÇA RH,TEMPO EXCEDIDO,NORMALIZADO,ALTA,SIM,NÃO,,,
I722EME3702,OPERAÇÃO UNID HIDR VVAS PARTIDA,TEMPO EXCEDIDO,NORMALIZADO,ALTA,SIM,NÃO,,,
I722EME3801,OPERAÇÃO UNID HIDR BYPASS AP TURBINA,TEMPO EXCEDIDO,NORMALIZADO,ALTA,SIM,NÃO,,,
I722EML1002,BOMBA 1 RECUPERAÇÃO DRENOS CALDEIRA,LIGADA,DESLIGADA,MEDIA,NÃO,NÃO,,,
I722EML1003,BOMBA 2 RECUPERAÇÃO DRENOS CALDEIRA,LIGADA,DESLIGADA,MEDIA,NÃO,NÃO,,,
I722EML3001,BOMBA RECIRCULAÇÃO CALDEIRA,LIGADA,DESLIGADA,MEDIA,NÃO,NÃO,,,
I722EML3701,UNID HIDR VVAS SEGURANÇA RH,LIGADA,DESLIGADA,MEDIA,NÃO,NÃO,,,
I722EML3702,UNID HIDR VVAS PARTIDA,LIGADA,DESLIGADA,MEDIA,NÃO,NÃO,,,
I722EML3801,UNID HIDR BYPASS TURBINA AP,LIGADA,DESLIGADA,MEDIA,NÃO,NÃO,,,
I722EMT1002,BOMBA 1 RECUPERAÇÃO DRENOS CALDEIRA,TRIP ELÉTRICO,NORMALIZADO,ALTA,SIM,NÃO,,,
I722EMT1003,BOMBA 2 RECUPERAÇÃO DRENOS CALDEIRA,TRIP ELÉTRICO,NORMALIZADO,ALTA,SIM,NÃO,,,
I722EMT3001,BOMBA RECIRCULAÇÃO CALDEIRA,TRIP ELÉTRICO,NORMALIZADO,ALTA,SIM,NÃO,,,
I722EMT3701,UNID HIDR VVAS SEGURANÇA RH,TRIP ELÉTRICO,NORMALIZADO,ALTA,SIM,NÃO,,,
I722EMT3702,UNID HIDR VVAS PARTIDA,TRIP ELÉTRICO,NORMALIZADO,ALTA,SIM,NÃO,,,
I722EMT3801,UNID HIDR BYPASS TURBINA AP,TRIP ELÉTRICO,NORMALIZADO,ALTA,SIM,NÃO,,,
I722EZ10170,TRIP CALDEIRA - FALHA ABERTURA BY-PASS APÓS TRIP TURBINA,ATUADO,NORMALIZADO,ALTA,SIM,NÃO,,,
I722EZ101E30,TRIP CALDEIRA-BBAS ALIM DESL > 10s,ATUADO,NORMALIZADO,ALTA,SIM,NÃO,,,
I722EZ101E57,TRIP CALDEIRA-FALHA VVLAS TURBINA,ATUADO,NORMALIZADO,ALTA,SIM,NÃO,,,
I722EZ101E58,TRIP CALDEIRA-VENTILADORES DETETORES CHAMA DESLIGADOS,ATUADO,NORMALIZADO,ALTA,SIM,NÃO,,,
I722EZ101R,CONDIÇÃO LIBERAÇÃO CHAMA,AUSENTE,NORMALIZADO,ALTA,SIM,NÃO,,,
I722EZXA09,BOTÃO TRIP CALDEIRA - SALA COMANDO,ATUADO,NORMALIZADO,ALTA,SIM,NÃO,,,
I722FL3051,VAZÃO ÁGUA RESFR BAR TERM BB RECIRC CALD,BAIXO,NORMALIZADO,ALTA,SIM,NÃO,,,
I722FL3052,VAZÃO ÁGUA RESFR MOTOR BB RECIRC CALD,BAIXO,NORMALIZADO,ALTA,SIM,NÃO,,,
I722LL3002,NÍVEL SEPARADOR,BAIXO,NORMALIZADO,ALTA,SIM,NÃO,,,
I722LLL3612,NÍVEL TANQUE RECUP DRENOS CALDEIRA,MUITO BAIXO,NORMALIZADO,MEDIA,SIM,NÃO,,,
I722LVH3616,NÍVEL TANQUE RECUP DRENOS CALDEIRA,ALTISSIMO,NORMALIZADO,MEDIA,SIM,NÃO,,,
I722PH3535,PRESSÃO VAPOR ENTRADA RH1 LD CALDEIRA (LOGICA 2 DE 3),ALTO,NORMALIZADO,ALTA,SIM,NÃO,,,
I722PHH3703,PRESSÃO UNID HIDR VVAS SEGURANÇA RH,MUITO ALTO,NORMALIZADO,MEDIA,SIM,NÃO,,,
I722PHH3709,PRESSÃO UNID HIDR VVAS PARTIDA,MUITO ALTO,NORMALIZADO,MEDIA,SIM,NÃO,,,
I722PHH3803,PRESSÃO UNID HIDR BYPASS TURBINA AP,MUITO ALTO,NORMALIZADO,MEDIA,SIM,NÃO,,,
I722PLL3702,PRESSÃO UNID HIDR VVAS SEGURANÇA RH,MUITO BAIXO,NORMALIZADO,MEDIA,SIM,NÃO,,,
I722PLL3708,PRESSÃO UNID HIDR VVAS PARTIDA,MUITO BAIXO,NORMALIZADO,MEDIA,SIM,NÃO,,,
I722PLL3802,PRESSÃO UNID HIDR BYPASS AP TURBINA,MUITO BAIXO,NORMALIZADO,MEDIA,SIM,NÃO,,,
I722TH3419,TEMP VAPOR SAÍDA SH2 LE CALDEIRA,ALTO,NORMALIZADO,MEDIA,SIM,NÃO,,,
I722TH3422,TEMP VAPOR SAÍDA SH2 LD CALDEIRA,ALTO,NORMALIZADO,MEDIA,SIM,NÃO,,,
I722TH3534,TEMP VAPOR ENTRADA RH1 LE CALDEIRA,ALTO,NORMALIZADO,MEDIA,SIM,NÃO,,,
I722TH3537,TEMP VAPOR ENTRADA RH1 LD CALDEIRA,ALTO,NORMALIZADO,MEDIA,SIM,NÃO,,,
I722TH3616,TEMP ENROL MOTOR BBA 1 RECUP DREN CALD,ALTO,NORMALIZADO,MEDIA,SIM,NÃO,,,
I722TH3621,TEMP MANCAL LA OU LNA MOTOR BBA 1 REC DREN CALD,ALTO,NORMALIZADO,MEDIA,SIM,NÃO,,,
I722TH3636,TEMP ENROL MOTOR BBA 2 RECUP DREN CALD,ALTO,NORMALIZADO,MEDIA,SIM,NÃO,,,
I722TH3641,TEMP MANCAL LA OU LNA MOTOR BBA 2 REC DREN CALD,ALTO,NORMALIZADO,MEDIA,SIM,NÃO,,,
I722TH3651,TEMP ENROL MOTOR BBA RECIRC CALDEIRA,ALTO,NORMALIZADO,MEDIA,SIM,NÃO,,,
I722TH3658,TEMP ÁGUA RESFR BBA RECIRC CALDEIRA,ALTO,NORMALIZADO,MEDIA,SIM,NÃO,,,
I722THH3339,TEMP VAPOR SAÍDA EVAPORADOR LE CALDEIRA,MUITO ALTO,NORMALIZADO,ALTA,SIM,NÃO,,,
I722THH3348,TEMP VAPOR SAÍDA EVAPORADOR LD CALDEIRA,MUITO ALTO,NORMALIZADO,ALTA,SIM,NÃO,, ,
I722THH3544,TEMP VAPOR SAÍDA RH1 LE CALDEIRA,MUITO ALTO,NORMALIZADO,ALTA,SIM,NÃO,,,
I722THH3551,TEMP VAPOR SAÍDA RH1 LD CALDEIRA,MUITO ALTO,NORMALIZADO,ALTA,SIM,NÃO,,,
I722THH3622,TEMP MANCAL LNA MOTOR BBA 1 REC DREN CALD,MUITO ALTO,NORMALIZADO,MEDIA,SIM,NÃO,,,
I722THH3624,TEMP MANCAL LA MOTOR BBA 1 REC DREN CALD,MUITO ALTO,NORMALIZADO,MEDIA,SIM,NÃO,,,
I722THH3642,TEMP MANCAL LNA MOTOR BBA 2 REC DREN CALD,MUITO ALTO,NORMALIZADO,MEDIA,SIM,NÃO,,,
I722THH3644,TEMP MANCAL LA MOTOR BBA 2 REC DREN CALD,MUITO ALTO,NORMALIZADO,MEDIA,SIM,NÃO,,,
I722THH3652,TEMP ENROL MOTOR BBA RECIRC CALDEIRA,MUITO ALTO,NORMALIZADO,ALTA,SIM,NÃO,,,
I722ZH1069,VVA DESC BBA 2 RECUP DRENOS CALDEIRA,ABERTA,NÃO ABERTA,BAIXA,NÃO,NÃO,,,
I722ZH1071,VVA RECIRC BBA 1 RECUP DRENOS CALDEIRA,ABERTA,NÃO ABERTA,BAIXA,NÃO,NÃO,,,
I722ZH1073,VVA RECIRC BBA 2 RECUP DRENOS CALDEIRA,ABERTA,NÃO ABERTA,BAIXA,NÃO,NÃO,,,
I722ZH1075,VVA DESC BBA 1 RECUP DRENOS CALDEIRA,ABERTA,NÃO ABERTA,BAIXA,NÃO,NÃO,,,
I722ZH2027,VVA ADMS BBA RECIRCULAÇÃO CALDEIRA,ABERTA,NÃO ABERTA,BAIXA,NÃO,NÃO,,,
I722ZL1070,VVA DESC BBA 2 RECUP DRENOS CALDEIRA,FECHADA,NÃO FECHADA,BAIXA,NÃO,NÃO,,,
I722ZL1072,VVA RECIRC BBA 1 RECUP DRENOS CALDEIRA,FECHADA,NÃO FECHADA,BAIXA,NÃO,NÃO,,,
I722ZL1074,VVA RECIRC BBA 2 RECUP DRENOS CALDEIRA,FECHADA,NÃO FECHADA,BAIXA,NÃO,NÃO,,,
I722ZL1076,VVA DESC BBA 1 RECUP DRENOS CALDEIRA,FECHADA,NÃO FECHADA,BAIXA,NÃO,NÃO,,,
I722ZL2026,VÁLVULAS CONTROLE BY-PASS TURBINA AP,NÃO FECHADAS,FECHADAS,ALTA,NÃO,SIM,,,
I722ZL2028,VVA ADMS BBA RECIRCULAÇÃO CALDEIRA,FECHADA,NÃO FECHADA,MEDIA,NÃO,NÃO,,,
I722ZM1164,VVA DESC E VVA RECIRC BBA 1 RECUP DREN CAL,NÃO ABERTA,NORMALIZADO,MEDIA,NÃO,NÃO,,,
I722ZM1167,VVA DESC E VVA RECIRC BBA 2 RECUP DREN CAL,NÃO ABERTA,NORMALIZADO,MEDIA,NÃO,NÃO,,,
I722ZM2055,VVA ADMS BBA RECIRCULAÇÃO CALDEIRA,NÃO ABERTA,NORMALIZADO,MEDIA,SIM,NÃO,,,
I723AH3205,TEOR CO2 GASES SAÍDA CALDEIRA,ALTO,NORMALIZADO,MEDIA,SIM,NÃO,,,
I723AH3207,TEOR CO GASES SAÍDA CALDEIRA,ALTO,NORMALIZADO,MEDIA,SIM,NÃO,,,
I723AL3203,TEOR O2 GASES SAÍDA CALDEIRA,BAIXO,NORMALIZADO,MEDIA,SIM,NÃO,,,
I723DIH3104,MONITORAÇÃO PRES AR SEC APÓS AQUEC,DISCREPANCIA,NORMALIZADO,MEDIA,SIM,NÃO,,,
I723DPH3504,PRES DIF FILTRO ÓLEO LUB VENT INDUZIDO 1,ALTO,NORMALIZADO,MEDIA,SIM,NÃO,,,
I723DPH3514,PRES DIF FILTRO ÓLEO LUB VENT INDUZIDO 2,ALTO,NORMALIZADO,MEDIA,SIM,NÃO,,,
I723EFT1001,PRECIPITADOR ELETROSTÁTICO 1 OU 2,FALHA,NORMALIZADO,MEDIA,SIM,NÃO,,,
I723EMD1005,VENTILADOR FORÇADO 1,DESLIGADO,LIGADO,ALTA,NÃO,NÃO,,,
I723EMD1012,VENTILADOR FORÇADO 2,DESLIGADO,LIGADO,ALTA,NÃO,NÃO,,,
I723EMD1101,VENTILADOR INDUZIDO 1,DESLIGADO,LIGADO,ALTA,NÃO,NÃO,,,
I723EMD1102,VENTILADOR INDUZIDO 2,DESLIGADO,LIGADO,ALTA,NÃO,NÃO,,,
I723EMD2075,MOTOR 1 AQUECEDOR REGENERATIVO 1,DESLIGADO,LIGADO,ALTA,NÃO,NÃO,,,
I723EMD2076,MOTOR 2 AQUECEDOR REGENERATIVO 1,DESLIGADO,LIGADO,ALTA,NÃO,NÃO,,,
I723EMD2077,MOTOR 1 AQUECEDOR REGENERATIVO 2,DESLIGADO,LIGADO,ALTA,NÃO,NÃO,,,
I723EMD2078,MOTOR 2 AQUECEDOR REGENERATIVO 2,DESLIGADO,LIGADO,ALTA,NÃO,NÃO,,,
I723EML1005,VENTILADOR FORÇADO 1,LIGADO,DESLIGADO,MEDIA,NÃO,NÃO,,,
I723EML1012,VENTILADOR FORÇADO 2,LIGADO,DESLIGADO,MEDIA,NÃO,NÃO,,,
I723EML1101,VENTILADOR INDUZIDO 1,LIGADO,DESLIGADO,MEDIA,NÃO,NÃO,,,
I723EML1101D,VENT INDUZIDOS DESL E VENT FORÇADO 1 LIGADO,PRESENTE,NORMALIZADO,ALTA,SIM,NÃO,,,
I723EML1102,VENTILADOR INDUZIDO 2,LIGADO,DESLIGADO,MEDIA,NÃO,NÃO,,,
I723EML1102D,VENT INDUZIDOS DESL E VENT FORÇADO 2 LIGADO,PRESENTE,NORMALIZADO,ALTA,SIM,NÃO,,,
I723EML2075,MOTOR 1 AQUECEDOR REGENERATIVO 1,LIGADO,DESLIGADO,MEDIA,NÃO,NÃO,,,
I723EML2076,MOTOR 2 AQUECEDOR REGENERATIVO 1,LIGADO,DESLIGADO,MEDIA,NÃO,NÃO,,,
I723EML2077,MOTOR 1 AQUECEDOR REGENERATIVO 2,LIGADO,DESLIGADO,MEDIA,NÃO,NÃO,,,
I723EML2078,MOTOR 2 AQUECEDOR REGENERATIVO 2,LIGADO,DESLIGADO,MEDIA,NÃO,NÃO,,,
I723EMS2070,BB 1 ÓLEO LUB AQ REGEN - PARTIDA STANDBY,ATUADO,NORMALIZADO,MEDIA,SIM,NÃO,,,
I723EMS2071,BB 2 ÓLEO LUB AQ REGEN - PARTIDA STANDBY,ATUADO,NORMALIZADO,MEDIA,SIM,NÃO,,,
I723EMS3104,BBA 2 ÓLEO LUB VI 1 - PARTIDA STANDBY,ATUADO,NORMALIZADO,MEDIA,SIM,NÃO,,,
I723EMS3103,BBA 1 ÓLEO LUB VI 1 - PARTIDA STANDBY,ATUADO,NORMALIZADO,MEDIA,SIM,NÃO,,,
I723EMS3106,BBA 2 ÓLEO LUB VI 2 - PARTIDA STANDBY,ATUADO,NORMALIZADO,MEDIA,SIM,NÃO,,,
I723EMS3105,BBA 1 ÓLEO LUB VI 2 - PARTIDA STANDBY,ATUADO,NORMALIZADO,MEDIA,SIM,NÃO,,,
I723EMT1005,VENTILADOR FORÇADO 1,TRIP ELÉTRICO,NORMALIZADO,ALTA,SIM,NÃO,,,
I723EMT1012,VENTILADOR FORÇADO 2,TRIP ELÉTRICO,NORMALIZADO,ALTA,SIM,NÃO,,,
I723EMT1101,VENTILADOR INDUZIDO 1,TRIP ELÉTRICO,NORMALIZADO,ALTA,SIM,NÃO,,,
I723EMT1102,VENTILADOR INDUZIDO 2,TRIP ELÉTRICO,NORMALIZADO,ALTA,SIM,NÃO,,,
I723EMT2075,MOTOR 1 AQUECEDOR REGENERATIVO 1,TRIP ELÉTRICO,NORMALIZADO,ALTA,SIM,NÃO,,,
I723EMT2076,MOTOR 2 AQUECEDOR REGENERATIVO 1,TRIP ELÉTRICO,NORMALIZADO,ALTA,SIM,NÃO,,,
I723EMT2077,MOTOR 1 AQUECEDOR REGENERATIVO 2,TRIP ELÉTRICO,NORMALIZADO,ALTA,SIM,NÃO,,,
I723EMT2078,MOTOR 2 AQUECEDOR REGENERATIVO 2,TRIP ELÉTRICO,NORMALIZADO,ALTA,SIM,NÃO,,,
I723EPE2001F,PLACAS SELAGEM AQUEC REGENERATIVO 1,,,,,,,,
I723EPE2001M,PLACAS SELAGEM AQUEC REGENERATIVO 1,,,,,,,,
I723EPE2002F,PLACAS SELAGEM AQUEC REGENERATIVO 2,,,,,,,,
I723EPE2002M,PLACAS SELAGEM AQUEC REGENERATIVO 2,,,,,,,,
I723ESM3029,TERMOSONDA LADO ESQUERDO,,,,,,,,
I723ESM3030,TERMOSONDA LADO DIREITO,FALHA,NORMALIZADO,MEDIA,SIM,NÃO,,,
I723FHH3152,AR COMBUSTÃO - VAZÃO DE PURGA,PRESENTE,AUSENTE,MEDIA,SIM,NÃO,,,
I723FL3112,VAZÃO AR SECUNDÁRIO FILA 1,BAIXO,NORMALIZADO,MEDIA,SIM,SIM,,,
I723FL3122,VAZÃO AR SECUNDÁRIO FILA 2,BAIXO,NORMALIZADO,MEDIA,SIM,SIM,,,
I723FL3132,VAZÃO AR SECUNDÁRIO FILA 3,BAIXO,NORMALIZADO,MEDIA,SIM,SIM,,,
I723FL3142,VAZÃO AR SECUNDÁRIO FILA 4,BAIXO,NORMALIZADO,MEDIA,SIM,SIM,,,
I723FL3501,VAZÃO ÓLEO LUB P/ MANCAL LA VENT IND 1,BAIXO,NORMALIZADO,MEDIA,SIM,NÃO,,,
I723FL3511,VAZÃO ÓLEO LUB P/ MANCAL LNA VENT IND 2,BAIXO,NORMALIZADO,MEDIA,SIM,NÃO,,,
I723FL3512,VAZÃO ÓLEO LUB P/ MANCAL LA VENT IND 2,BAIXO,NORMALIZADO,MEDIA,SIM,NÃO,,,
I723FLL3155,VAZÃO TOTAL AR COMBUSTÃO (NFPA),MUITO BAIXO,NORMALIZADO,ALTA,SIM,NÃO,,,
I723LL2406,NÍVEL TANQUE ÓLEO LUBRIF AQUEC REGEN,BAIXO,NORMALIZADO,MEDIA,SIM,NÃO,,,
I723LLL2407,NÍVEL TANQUE ÓLEO LUBRIF AQUEC REGEN,MUITO BAIXO,NORMALIZADO,MEDIA,SIM,NÃO,,,
I723MFT1001,PRECIPITADOR ELETROSTÁTICO,FALHA,NORMALIZADO,BAIXO,NÃO,NÃO,,,
I723PHH3201,PRESSÃO FORNALHA,MUITO ALTO,NORMALIZADO,ALTA,SIM,SIM,,,
I723PL2401,PRES DESC BBAS ÓLEO LUBRIF AQUEC REGEN,BAIXO,NORMALIZADO,ALTA,SIM,NÃO,,,
I723PL3501,PRES ÓLEO LUBRIF VENT INDUZIDO 1,BAIXO,NORMALIZADO,MEDIA,SIM,NÃO,,,
I723PL3511,PRES ÓLEO LUBRIF VENT INDUZIDO 2,BAIXO,NORMALIZADO,MEDIA,SIM,NÃO,,,
I723PLL3202,PRESSÃO FORNALHA,MUITO BAIXO,NORMALIZADO,ALTA,SIM,NÃO,,,
I723PLL3502,PRESSÃO ÓLEO LUBRIF VENT INDUZIDO 1,MUITO BAIXO,NORMALIZADO,ALTA,SIM,NÃO,,,
I723PLL3512,PRESSÃO ÓLEO LUBRIF VENT INDUZIDO 2,MUITO BAIXO,NORMALIZADO,ALTA,SIM,NÃO,,,
I723TH2429,AQUECEDOR DE AR A23MPA2001-EQUIPAMENTO DETETOR DE CALOR,,,,,,,,
I723TH2459,AQUECEDOR DE AR A23PA2002 EQUIPAMENTO DETETOR DE CALOR,,,,,,,,
I723TH3005,TEMP MANCAIS VENT FORÇADO 1,ALTO,NORMALIZADO,MEDIA,SIM,NÃO,,,
I723TH3009,TEMP MANCAIS MOTOR VENT FORÇADO 1,ALTO,NORMALIZADO,MEDIA,SIM,NÃO,,,
I723TH3014,TEMP ENROL MOTOR VENT FORÇADO 1,ALTO,NORMALIZADO,MEDIA,SIM,NÃO,,,
I723TH3025,TEMP MANCAIS VENT FORÇADO 2,ALTO,NORMALIZADO,MEDIA,SIM,NÃO,,,
I723TH3029,TEMP MANCAIS MOTOR VENT FORÇADO 2,ALTO,NORMALIZADO,MEDIA,SIM,NÃO,,,
I723TH3034,TEMP ENROL MOTOR VENT FORÇADO 2,ALTO,NORMALIZADO,MEDIA,SIM,NÃO,,,
I723TH3201,TEMP FORNALHA LE (TERMO SONDA),,,,,,,,
I723TH3202,TEMP FORNALHA LD (TERMO SONDA),ALTO,NORMALIZADO,MEDIA,SIM,NÃO,,,
I723TH3269,TEMP GÁSES ENTRADA PRECIP 1 LE,ALTO,NORMALIZADO,MEDIA,SIM,NÃO,,,
I723TH3279,TEMP GÁSES ENTRADA PRECIP 1 LD,ALTO,NORMALIZADO,MEDIA,SIM,NÃO,,,
I723TH3294,TEMP GÁSES ENTRADA PRECIP 2 LE,MUITO ALTO,NORMALIZADO,MEDIA,SIM,NÃO,,,
I723TH3295,TEMP GASES ENTRADA PRECIP 2 LE,ALTO,NORMALIZADO,MEDIA,SIM,NÃO,,,
I723TH3297,TEMP GÁSES ENTRADA PRECIP 2 LD,MUITO ALTO,NORMALIZADO,MEDIA,SIM,NÃO,,,
I723TH3300,TEMP GASES ENTRADA PRECIP 2 LD,ALTO,NORMALIZADO,MEDIA,SIM,NÃO,,,
I723TH3401,TEMP MANCAIS AQUEC REGENERATIVO 1,ALTO,NORMALIZADO,MEDIA,SIM,NÃO,,,
I723TH3431,TEMP MANCAIS AQUEC REGENERATIVO 2,ALTO,NORMALIZADO,MEDIA,SIM,NÃO,,,
I723TH3501,TEMP MANCAIS VENT INDUZIDO 1,ALTO,NORMALIZADO,MEDIA,SIM,NÃO,,,
I723TH3505,TEMP MANCAIS MOTOR VENT INDUZIDO 1,ALTO,NORMALIZADO,MEDIA,SIM,NÃO,,,
I723TH3511,TEMP ENROL MOTOR VENT INDUZIDO 1,ALTO,NORMALIZADO,MEDIA,SIM,NÃO,,,
I723TH3521,TEMP MANCAIS VENT INDUZIDO 2,ALTO,NORMALIZADO,MEDIA,SIM,NÃO,,,
I723TH3525,TEMP MANCAIS MOTOR VENT INDUZIDO 2,ALTO,NORMALIZADO,MEDIA,SIM,NÃO,,,
I723TH3531,TEMP ENROL MOTOR VENT INDUZIDO 2,ALTO,NORMALIZADO,MEDIA,SIM,NÃO,,,
I723THH2465,TEMP ÓLEO LUB AQUEC REGENERATIVOS,MUITO ALTO,NORMALIZADO,MEDIA,SIM,NÃO,,,
I723THH3006,TEMP MANCAL LNA VENT FORÇADO 1,MUITO ALTO,NORMALIZADO,ALTA,SIM,NÃO,,,
I723THH3008,TEMP MANCAL LA VENT FORÇADO 1,MUITO ALTO,NORMALIZADO,ALTA,SIM,NÃO,,,
I723THH3010,TEMP MANCAL LA MOTOR VENT FORÇADO 1,MUITO ALTO,NORMALIZADO,ALTA,SIM,NÃO,,,
I723THH3012,TEMP MANCAL LNA MOTOR VENT FORÇADO 1,MUITO ALTO,NORMALIZADO,ALTA,SIM,NÃO,,,
I723THH3026,TEMP MANCAL LNA VENT FORÇADO 2,MUITO ALTO,NORMALIZADO,ALTA,SIM,NÃO,,,
I723THH3028,TEMP MANCAL LA VENT FORÇADO 2,MUITO ALTO,NORMALIZADO,ALTA,SIM,NÃO,,,
I723THH3030,TEMP MANCAL LA MOTOR VENT FORÇADO 2,MUITO ALTO,NORMALIZADO,ALTA,SIM,NÃO,,,
I723THH3032,TEMP MANCAL LNA MOTOR VENT FORÇADO 2,MUITO ALTO,NORMALIZADO,ALTA,SIM,NÃO,,,
I723THH3268,TEMP GASES ENTRADA PRECIPITADOR 1 LE,MUITO ALTO,NORMALIZADO,MEDIA,SIM,NÃO,,,
I723THH3271,TEMP GASES ENTRADA PRECIPITADOR 1 LD,MUITO ALTO,NORMALIZADO,MEDIA,SIM,NÃO,,,
I723THH3402,TEMP MANCAL INF AQUEC REGENERATIVO 1,MUITO ALTO,NORMALIZADO,ALTA,SIM,NÃO,,,
I723THH3405,TEMP MANCAL SUP AQUEC REGENERATIVO 1,MUITO ALTO,NORMALIZADO,ALTA,SIM,NÃO,,,
I723THH3432,TEMP MANCAL INF AQUEC REGENERATIVO 2,MUITO ALTO,NORMALIZADO,ALTA,SIM,NÃO,,,
I723THH3435,TEMP MANCAL SUP AQUEC REGENERATIVO 2,MUITO ALTO,NORMALIZADO,ALTA,SIM,NÃO,,,
I723THH3502,TEMP MANCAL LA VENT INDUZIDO 1,MUITO ALTO,NORMALIZADO,ALTA,SIM,NÃO,,,
I723THH3504,TEMP MANCAL LNA VENT INDUZIDO 1,MUITO ALTO,NORMALIZADO,ALTA,SIM,NÃO,,,
I723THH3506,TEMP MANCAL LNA MOTOR VENT INDUZIDO 1,MUITO ALTO,NORMALIZADO,ALTA,SIM,NÃO,,,
I723THH3508,TEMP MANCAL LA MOTOR VENT INDUZIDO 1,MUITO ALTO,NORMALIZADO,ALTA,SIM,NÃO,,,
I723THH3522,TEMP MANCAL LNA VENT INDUZIDO 2,MUITO ALTO,NORMALIZADO,ALTA,SIM,NÃO,,,
I723THH3524,TEMP MANCAL LA VENT INDUZIDO 2,MUITO ALTO,NORMALIZADO,ALTA,SIM,NÃO,,,
I723THH3526,TEMP MANCAL LA MOTOR VENT INDUZIDO 2,MUITO ALTO,NORMALIZADO,ALTA,SIM,NÃO,,,
I723THH3528,TEMP MANCAL LNA MOTOR VENT INDUZIDO 2,MUITO ALTO,NORMALIZADO,ALTA,SIM,NÃO,,,
I723TLL2471,TEMP ÓLEO LUB AQUEC REGENERATIVOS,MUITO BAIXA,NORMALIZADO,MEDIA,SIM,NÃO,,,
I723TVH3466,TEMP ÓLEO LUB AQUEC REGENERATIVOS,ALTISSIMA,NORMALIZADO,MEDIA,SIM,NÃO,,,
I723TVL3467,TEMP ÓLEO LUB AQUEC REGENERATIVOS,BAIXISSIMA,NORMALIZADO,MEDIA,SIM,NÃO,,,
I723ZH2001,COMPORTA 1 ADM AR QUENTE VENT FORÇADO 1,NÃO ABERTA,ABERTA,MEDIA,SIM,SIM,,,
I723ZH2003,COMPORTA 2 ADM AR QUENTE VENT FORÇADO 1,NÃO ABERTA,ABERTA,MEDIA,SIM,SIM,,,
I723ZH2005,COMPORTA 1 ADM AR FRIO VENT FORÇADO 1,ABERTA,NÃO ABERTA,MEDIA,NÃO,NÃO,,,
I723ZH2007,COMPORTA 2 ADM AR FRIO VENT FORÇADO 1,ABERTA,NÃO ABERTA,MEDIA,NÃO,NÃO,,,
I723ZH2011,COMPORTA 1 DESC VENT FORÇADO 1,NÃO ABERTA,ABERTA,MEDIA,SIM,SIM,,,
I723ZH2013,COMPORTA 2 DESC VENT FORÇADO 1,NÃO ABERTA,ABERTA,MEDIA,SIM,SIM,,,
I723ZH2031,COMPORTA 1 GASES ENTR AQ REGENERATIVO 1,ABERTA,NÃO ABERTA,MEDIA,NÃO,NÃO,,,
I723ZH2031A,COMPORTA 1 ADM AR QUENTE VENT FORÇADO 2,NÃO ABERTA,ABERTA,MEDIA,SIM,SIM,,,
I723ZH2032,COMPORTA 2 GASES ENTR AQ REGENERATIVO 1,ABERTA,NÃO ABERTA,MEDIA,NÃO,NÃO,,,
I723ZH2033,COMPORTA 3 GASES ENTR AQ REGENERATIVO 1,ABERTA,NÃO ABERTA,MEDIA,NÃO,NÃO,,,
I723ZH2033A,COMPORTA 2 ADM AR QUENTE VENT FORÇADO 2,NÃO ABERTA,ABERTA,MEDIA,SIM,SIM,,,
I723ZH2034,COMPORTA 4 GASES ENTR AQ REGENERATIVO 1,ABERTA,NÃO ABERTA,MEDIA,NÃO,NÃO,,,
I723ZH2035,COMPORTA 5 GASES ENTR AQ REGENERATIVO 1,ABERTA,NÃO ABERTA,MEDIA,NÃO,NÃO,,,
I723ZH2035A,COMPORTA 1 ADM AR FRIO VENT FORÇADO 2,ABERTA,NÃO ABERTA,MEDIA,NÃO,NÃO,,,
I723ZH2036,COMPORTA 6 GASES ENTR AQ REGENERATIVO 1,ABERTA,NÃO ABERTA,MEDIA,NÃO,NÃO,,,
I723ZH2037,COMPORTA 3 GASES SAÍDA AQ REGENERATIVO 1,,,,,,,,
I723ZH2037A,COMPORTA 2 ADM AR FRIO VENT FORÇADO 2,ABERTA,NÃO ABERTA,MEDIA,NÃO,NÃO,,,
I723ZH2038,COMPORTA 1 BY-PASS GASES AQ REGENERATIVO 1,ABERTA,NÃO ABERTA,MEDIA,NÃO,NÃO,,,
I723ZH2039,COMPORTA 2 BY-PASS GASES AQ REGENERATIVO 1,ABERTA,NÃO ABERTA,MEDIA,NÃO,NÃO,,,
I723ZH2040,COMPORTA 1 GASES ENTR AQ REGENERATIVO 2,ABERTA,NÃO ABERTA,MEDIA,NÃO,NÃO,,,
I723ZH2041,COMPORTA 2 GASES ENTR AQ REGENERATIVO 2,ABERTA,NÃO ABERTA,MEDIA,NÃO,NÃO,,,
I723ZH2041A,COMPORTA 1 DESC VENT FORÇADO 2,NÃO ABERTA,ABERTA,MEDIA,SIM,SIM,,,
I723ZH2042,COMPORTA 3 GASES ENTR AQ REGENERATIVO 2,ABERTA,NÃO ABERTA,MEDIA,NÃO,NÃO,,,
I723ZH2043,COMPORTA 4 GASES ENTR AQ REGENERATIVO 2,ABERTA,NÃO ABERTA,MEDIA,NÃO,NÃO,,,
I723ZH2043A,COMPORTA 2 DESC VENT FORÇADO 2,NÃO ABERTA,ABERTA,MEDIA,SIM,SIM,,,
I723ZH2044,COMPORTA 5 GASES ENTR AQ REGENERATIVO 2,ABERTA,NÃO ABERTA,MEDIA,NÃO,NÃO,,,
I723ZH2045,COMPORTA 6 GASES ENTR AQ REGENERATIVO 2,ABERTA,NÃO ABERTA,MEDIA,NÃO,NÃO,,,
I723ZH2046,COMPORTA 3 GASES SAÍDA AQ REGENERATIVO 2,ABERTA,NÃO ABERTA,MEDIA,NÃO,,,,
I723ZH2047,COMPORTA 1 BY-PASS AQ REGENERATIVO 2,ABERTA,NÃO ABERTA,MEDIA,NÃO,NÃO,,,
I723ZH2048,COMPORTA 2 BY-PASS AQ REGENERATIVO 2,ABERTA,NÃO ABERTA,MEDIA,NÃO,NÃO,,,
I723ZH2059,COMPORTA 1 DESC VENT INDUZIDO 1,NÃO ABERTA,ABERTA,MEDIA,SIM,SIM,,,
I723ZH2060,COMPORTA 2 DESC VENT INDUZIDO 1,NÃO ABERTA,ABERTA,MEDIA,SIM,SIM,,,
I723ZH2061,COMPORTA 1 DESC VENT INDUZIDO 2,NÃO ABERTA,ABERTA,MEDIA,SIM,SIM,,,
I723ZH2062,COMPORTA 2 DESC VENT INDUZIDO 2,NÃO ABERTA,ABERTA,MEDIA,SIM,SIM,,,
I723ZH3401,MOTOR 2 AQUECEDOR REGENERATIVO 1,ACOPLADO,NÃO ACOPLADO,MEDIA,NÃO,NÃO,,,
I723ZH3402,MOTOR 1 AQUECEDOR REGENERATIVO 1,ACOPLADO,NÃO ACOPLADO,MEDIA,NÃO,NÃO,,,
I723ZH3403,MOTOR 1 AQUECEDOR REGENERATIVO 2,ACOPLADO,NÃO ACOPLADO,MEDIA,NÃO,NÃO,,,
I723ZH3404,MOTOR 2 AQUECEDOR REGENERATIVO 2,ACOPLADO,NÃO ACOPLADO,MEDIA,NÃO,NÃO,,,
I723ZL2001,VF1 - COMP ADM AR QUENTE NÃO ABERT E COMP ADM AR FRIA FECH,PRESENTE,NORMALIZADO,ALTA,SIM,NÃO,,,
I723ZL2008,VF2 - COMP ADM AR QUENTE NÃO ABERT E COMP ADM AR FRIA FECH,PRESENTE,NORMALIZADO,ALTA,SIM,NÃO,,,
I723ZL2012,COMPORTA 1 DESC VENT FORÇADO 1,FECHADA,NÃO FECHADA,MEDIA,NÃO,NÃO,,,
I723ZL2014,COMPORTA 2 DESC VENT FORÇADO 1,FECHADA,NÃO FECHADA,MEDIA,NÃO,NÃO,,,
I723ZL2031,COMPORTA 1 GASES ENTR AQ REGENERATIVO 1,FECHADA,NÃO FECHADA,MEDIA,NÃO,NÃO,,,
I723ZL2032,COMPORTA 2 GASES ENTR AQ REGENERATIVO 1,FECHADA,NÃO FECHADA,MEDIA,NÃO,NÃO,,,
I723ZL2033,COMPORTA 3 GASES ENTR AQ REGENERATIVO 1,FECHADA,NÃO FECHADA,MEDIA,NÃO,NÃO,,,
I723ZL2034,COMPORTA 4 GASES ENTR AQ REGENERATIVO 1,FECHADA,NÃO FECHADA,MEDIA,NÃO,NÃO,,,
I723ZL2035,COMPORTA 5 GASES ENTR AQ REGENERATIVO 1,FECHADA,NÃO FECHADA,MEDIA,NÃO,NÃO,,,
I723ZL2036,COMPORTA 6 GASES ENTR AQ REGENERATIVO 1,FECHADA,NÃO FECHADA,MEDIA,NÃO,NÃO,,,
I723ZL2037,COMPORTA 3 GASES SAÍDA AQ REGENERATIVO 1,,,,,,,,
I723ZL2038,COMPORTA 1 BY-PASS GASES AQ REGENERATIVO 1,NÃO FECHADA,FECHADA,MEDIA,SIM,SIM,,,
I723ZL2039,COMPORTA 2 BY-PASS GASES AQ REGENERATIVO 1,NÃO FECHADA,FECHADA,MEDIA,SIM,SIM,,,
I723ZL2040,COMPORTA 1 GASES ENTR AQ REGENERATIVO 2,FECHADA,NÃO FECHADA,MEDIA,NÃO,NÃO,,,
I723ZL2041,COMPORTA 2 GASES ENTR AQ REGENERATIVO 2,FECHADA,NÃO FECHADA,MEDIA,NÃO,NÃO,,,
I723ZL2042,COMPORTA 3 GASES ENTR AQ REGENERATIVO 2,FECHADA,NÃO FECHADA,MEDIA,NÃO,NÃO,,,
I723ZL2042A,COMPORTA 1 DESC VENT FORÇADO 2,FECHADA,NÃO FECHADA,MEDIA,NÃO,NÃO,,,
I723ZL2043,COMPORTA 4 GASES ENTR AQ REGENERATIVO 2,FECHADA,NÃO FECHADA,MEDIA,NÃO,NÃO,,,
I723ZL2044,COMPORTA 5 GASES ENTR AQ REGENERATIVO 2,FECHADA,NÃO FECHADA,MEDIA,NÃO,NÃO,,,
I723ZL2044A,COMPORTA 2 DESC VENT FORÇADO 2,FECHADA,NÃO FECHADA,MEDIA,NÃO,NÃO,,,
I723ZL2045,COMPORTA 6 GASES ENTR AQ REGENERATIVO 2,FECHADA,NÃO FECHADA,MEDIA,NÃO,NÃO,,,
I723ZL2046,COMPORTA 3 GASES SAÍDA AQ REGENERATIVO 2,,,,,,,,
I723ZL2047,COMPORTA 1 BY-PASS GASES AQ REGENERATIVO 2,NÃO FECHADA,FECHADA,MEDIA,NÃO,SIM,,,
I723ZL2048,COMPORTA 2 BY-PASS GASES AQ REGENERATIVO 2,NÃO FECHADA,FECHADA,MEDIA,NÃO,SIM,,,
I723ZL2049,COMPORTA 1 ENTR PRECIPITADOR 1 LE,,,,,,,,
I723ZL2050,COMPORTA 2 ENTR PRECIPITADOR 1 LE,,,,,,,,
I723ZL2051,COMPORTA 3 ENTR PRECIPITADOR 1 LD,,,,,,,,
I723ZL2052,COMPORTA 4 ENTR PRECIPITADOR 1 LD,,,,,,,,
I723ZL2053,COMPORTA 1 ENTR PRECIPITADOR 2 LE,,,,,,,,
I723ZL2054,COMPORTA 2 ENTR PRECIPITADOR 2 LE,,,,,,,,
I723ZL2055,COMPORTA 3 ENTR PRECIPITADOR 2 LD,,,,,,,,
I723ZL2056,COMPORTA 4 ENTR PRECIPITADOR 2 LD,,,,,,,,
I723ZL2059,COMPORTA 1 DESC VENT INDUZIDO 1,FECHADA,NÃO FECHADA,MEDIA,NÃO,NÃO,,,
I723ZL2060,COMPORTA 2 DESC VENT INDUZIDO 1,FECHADA,NÃO FECHADA,MEDIA,NÃO,NÃO,,,
I723ZL2061,COMPORTA 1 DESC VENT INDUZIDO 2,FECHADA,NÃO FECHADA,MEDIA,NÃO,NÃO,,,
I723ZL2062,COMPORTA 2 DESC VENT INDUZIDO 2,FECHADA,NÃO FECHADA,MEDIA,NÃO,NÃO,,,
I723ZM2006,COMPORTA DESC VENT FORÇADO 1,NÃO ABERTA,NORMALIZADO,ALTA,SIM,NÃO,,,
I723ZM2013,COMPORTA DESC VENT FORÇADO 2,NÃO ABERTA,NORMALIZADO,ALTA,SIM,NÃO,,,
I723ZS2403,MOTOR 1 AQR 2 ACOPLADO E DESLIGADO,PRESENTE,NORMALIZADO,MEDIA,NÃO,NÃO,,,
I723ZS2404,MOTOR 2 AQR 2 ACOPLADO E DESLIGADO,PRESENTE,NORMALIZADO,MEDIA,NÃO,NÃO,,,
I723ZS3401,MOTOR 2 AQR 1 ACOPLADO E DESLIGADO,PRESENTE,NORMALIZADO,MEDIA,NÃO,NÃO,,,
I723ZS3402,MOTOR 1 AQR 1 ACOPLADO E DESLIGADO,PRESENTE,NORMALIZADO,MEDIA,NÃO,NÃO,,,
I724BT1111,BOTOEIRA PARADA EMERGÊNCIA MOINHO 1,PRESSIONADA,NORMALIZADO,ALTA,SIM,NÃO,,,
I724BT1211,BOTOEIRA PARADA EMERGÊNCIA MOINHO 2,PRESSIONADA,NORMALIZADO,ALTA,SIM,NÃO, ,,
I724BT1311,BOTOEIRA PARADA EMERGÊNCIA MOINHO 3,PRESSIONADA,NORMALIZADO,ALTA,SIM,NÃO,,,
I724BT1411,BOTOEIRA PARADA EMERGÊNCIA MOINHO 4,PRESSIONADA,NORMALIZADO,ALTA,SIM,NÃO,,,
I724CAF1001,AUSÊNCIA CHAMA CARVÃO FILA 1,ATUADO,NORMALIZADO,ALTA,SIM,NÃO,,,
I724CAF1002,AUSÊNCIA CHAMA CARVÃO FILA 2,ATUADO,NORMALIZADO,ALTA,SIM,NÃO,,,
I724CAF1003,AUSÊNCIA CHAMA CARVÃO FILA 3,ATUADO,NORMALIZADO,ALTA,SIM,NÃO,,,
I724CAF1004,AUSÊNCIA CHAMA CARVÃO FILA 4,ATUADO,NORMALIZADO,ALTA,SIM,NÃO,,,
I724DPH3105,PRES DIFER FILTRO ÓLEO LUBRIF MOINHO 1,ALTO,NORMALIZADO,MEDIA,SIM,NÃO,,,
I724DPH3205,PRES DIFER FILTRO ÓLEO LUBRIF MOINHO 2,ALTO,NORMALIZADO,MEDIA,SIM,NÃO,,,
I724DPH3305,PRES DIFER FILTRO ÓLEO LUBRIF MOINHO 3,ALTO,NORMALIZADO,MEDIA,SIM,NÃO,,,
I724DPH3405,PRES DIFER FILTRO ÓLEO LUBRIF MOINHO 4,ALTO,NORMALIZADO,MEDIA,SIM,NÃO,,,
I724DPL3113,PRES DIFER AR SELAGEM / AR PRIM MOINHO 1,BAIXO,NORMALIZADO,MEDIA,SIM,NÃO,,,
I724DPL3213,PRES DIFER AR SELAGEM / AR PRIM MOINHO 2,BAIXO,NORMALIZADO,MEDIA,SIM,NÃO,,,
I724DPL3313,PRES DIFER AR SELAGEM / AR PRIM MOINHO 3,BAIXO,NORMALIZADO,MEDIA,SIM,NÃO,,,
