TAG,DESCRIÇÃO,ENTRADA,SAÍDA,SEVERIDADE,ALARME,Invertido,,,
I728TL3001,TEMP VAPOR  SOPRADORES FULIGEM CALDEIRA,BAIXO,NORMALIZADO,MEDIA,NÃO,NÃO,,,
I728TL3101,TEMP VAPOR  SOPRADORES AQ REGENERATIVO,BAIXO,NORMALIZADO,MEDIA,NÃO,NÃO,,,
I730DTH3021,DIF TEMP CARC SUP/INF EXAUST TURBINA AP,ALTO,NORMALIZADO,MEDIA,SIM,NÃO,,,
I730DTH3035,DIF TEMP CARC SUP/INF ENTRADA TURBINA MP,ALTO,NORMALIZADO,MEDIA,SIM,NÃO,,,
I730DTH3039,DIF TEMP CARC SUP/INF EXT TURBINA MP PARA AP 1,ALTO,NORMALIZADO,MEDIA,SIM,NÃO,,,
I730DTH3043,DIF TEMP CARC SUP/INF EXT TURBINA PARA DESAERADOR,ALTO,NORMALIZADO,MEDIA,SIM,NÃO,,,
I730DTH3051,DIF TEMP CARC SUP/INF EXT TURBINA BP LT PARA BP4,ALTO,NORMALIZADO,MEDIA,SIM,NÃO,,,
I730DTH3055,DIF TEMP CARC SUP/INF EXT TURBINA BP LG PARA BP4,ALTO,NORMALIZADO,MEDIA,SIM,NÃO,,,
I730DTH3059,DIF TEMP CARC SUP/INF EXT TURBINA BP LT PARA BP3,ALTO,NORMALIZADO,MEDIA,SIM,NÃO,,,
I730DTH3063,DIF TEMP CARC SUP/INF EXT TURBINA BP LG PARA BP3,ALTO,NORMALIZADO,MEDIA,SIM,NÃO,,,
I730SSL4001,SENSOR ZERO SPEED,ATUADO,NÃO ATUADO,ALTA,SIM,NÃO,,,
I730SSH4009,ROTAÇÃO TURBINA MAIOR QUE 200 RPM - A30ST4009,NÃO ATUADO,ATUADO,MEDIA,NÃO,NÃO,,,
I730T4008,SOBREVELOCIDADE TURBINA,ATUADO,NORMALIZADO,ALTA,SIM,NÃO,,,
I730TH3024,TEMP METAL CARC INF EXASTÃO TURBINA AP,ALTO,NORMALIZADO,MEDIA,SIM,NÃO,,,
I730TH3075,TEMP METAL CARC SUP EXT TURB BP PARA BP 1,ALTO,NORMALIZADO,MEDIA,SIM,NÃO,,,
I730THH3016,TEMP EXAUSTÃO TURBINA AP (LÓGICA 2 DE 3),MUITO ALTO,NORMALIZADO,ALTA,SIM,NÃO,,,
I730THH3070,TEMP METAL CARC SUP EXT TURB BP PARA BP 1 (LÓGICA 2 DE 3),MUITO ALTO,NORMALIZADO,ALTA,SIM,NÃO,,,
I730XH4002,VIBRAÇÃO MANCAL  1 TURBINA,ALTA,NORMALIZADO,ALTA,SIM,NÃO,,,
I730XH4003,VIBRAÇÃO MANCAL  2 TURBINA,ALTA,NORMALIZADO,ALTA,SIM,NÃO,,,
I730XH4004,VIBRAÇÃO MANCAL  3 TURBINA,ALTA,NORMALIZADO,ALTA,SIM,NÃO,,,
I730XH4005,VIBRAÇÃO MANCAL  4 TURBINA,ALTA,NORMALIZADO,ALTA,SIM,NÃO,,,
I730XH4006,VIBRAÇÃO MANCAL  5 TURBINA,ALTA,NORMALIZADO,ALTA,SIM,NÃO,,,
I730XH4007,VIBRAÇÃO MANCAL  6 TURBINA,ALTA,NORMALIZADO,ALTA,SIM,NÃO,,,
I730ZDH4001,EXPANSÃO DIFERENCIAL POSITIVA TURBINA AP,EXCEDIDO,NORMALIZADO,ALTA,SIM,NÃO,,,
I730ZDH4002,EXPANSÃO DIFERENCIAL POSITIVA TURBINA BP,EXCEDIDO,NORMALIZADO,ALTA,SIM,NÃO,,,
I730ZDL4001,EXPANSÃO DIFERENCIAL NEGATIVA TURBINA AP,EXCEDIDO,NORMALIZADO,ALTA,SIM,NÃO,,,
I730ZDL4002,EXPANSÃO DIFERENCIAL NEGATIVA TURBINA BP,EXCEDIDO,NORMALIZADO,ALTA,SIM,NÃO,,,
I730ZH4001,DESGASTE POSITIVO MANCAL ESCORA TURBINA,EXCEDIDO,NORMALIZADO,ALTA,SIM,NÃO,,,
I730ZH4003,DESGASTE MANCAL DE ESCORA (LOGICA 2 DE 3),MUITO ALTO,NORMALIZADO,ALTA,SIM,NÃO,,,
I730ZL4001,DESGASTE NEGATIVO MANCAL ESCORA TURBINA,EXCEDIDO,NORMALIZADO,ALTA,SIM,NÃO,,,
I730ZL4001A,CUBÍCULO SUPERVISÃO TURBINA - TSI,FALHA,NORMALIZADO,MEDIA,SIM,NÃO,,,
I7316U001XV04,TURBINA,REARMADA,BLOQUEADA,ALTA,NÃO,NÃO,,,
I7316U003XV11,TRIP TURBINA,PRESENTE,NORMALIZADO,ALTA,SIM,NÃO,,,
I731DI3001,MONITORAÇÃO VAZÃO VAPOR SH SAÍDA CALD LE,DISCREPANCIA,NORMALIZADO,MEDIA,SIM,NÃO,,,
I731DI3003,MONITORAÇÃO VAZÃO VAPOR SH SAÍDA CALD LD,DISCREPANCIA,NORMALIZADO,MEDIA,SIM,NÃO,,,
I731DIH3002,MONITORAÇÃO TEMP VAPOR SH SAÍDA CALD LE,DISCREPANCIA,NORMALIZADO,MEDIA,SIM,NÃO,,,
I731DIH3004,MONITORAÇÃO TEMP VAPOR SH SAÍDA CALD LE,DISCREPANCIA,NORMALIZADO,MEDIA,SIM,NÃO,,,
I731DIH3008,MONITORAÇÃO TEMP VAPOR SH SAÍDA CALD LD,DISCREPANCIA,NORMALIZADO,MEDIA,SIM,NÃO,,,
I731DIH3010,MONITORAÇÃO TEMP VAPOR SH SAÍDA CALD LD,DISCREPANCIA,NORMALIZADO,MEDIA,SIM,NÃO,,,
I731DIH3016,MONITORAÇÃO PRES VAPOR SH ENTR TURBINA AP,DISCREPANCIA,NORMALIZADO,MEDIA,SIM,NÃO,,,
I731DIH3031,MONITORAÇÃO TEMP VAPOR APÓS BY-PASS AP LE,DISCREPANCIA,NORMALIZADO,MEDIA,SIM,NÃO,,,
I731DIH3035,MONITORAÇÃO TEMP VAPOR APÓS BY-PASS AP LD,DISCREPANCIA,NORMALIZADO,MEDIA,SIM,NÃO,,,
I731DIH3052,MONITORAÇÃO TEMP VAPOR RH SAÍDA CALD LE,DISCREPANCIA,NORMALIZADO,MEDIA,SIM,NÃO,,,
I731DIH3053,MONITORAÇÃO TEMP VAPOR RH SAÍDA CALD LE,DISCREPANCIA,NORMALIZADO,MEDIA,SIM,NÃO,,,
I731DIH3058,MONITORAÇÃO TEMP VAPOR RH SAÍDA CALD LD,DISCREPANCIA,NORMALIZADO,MEDIA,SIM,NÃO,,,
I731DIH3059,MONITORAÇÃO TEMP VAPOR RH SAÍDA CALD LD,DISCREPANCIA,NORMALIZADO,MEDIA,SIM,NÃO,,,
I731DIH3062,MONITORAÇÃO PRES VAPOR RH ENTR TURBINA MP,DISCREPANCIA,NORMALIZADO,MEDIA,SIM,NÃO,,,
I731DPH4800,PRES DIF FILTRO DESCARGA BOMBA 1 OU 2 EHC,ALTO,NORMALIZADO,MEDIA,SIM,NÃO,,,
I731DTH3024,DIF TEMP VAPOR PRINCIPAL LE/LD,ALTO,NORMALIZADO,MEDIA,SIM,NÃO,,,
I731EMD4601,BOMBA 1 ÓLEO BYPASS BP,DESLIGADO,LIGADO,BAIXA,NÃO,NÃO,,,
I731EMD4602,BOMBA 2 ÓLEO BYPASS BP,DESLIGADO,LIGADO,BAIXA,NÃO,NÃO,,,
I731EMD4800,BOMBA 1 FLUÍDO HIDRÁULICO TURBINA,DESLIGADO,LIGADO,BAIXA,NÃO,NÃO,,,
I731EMD4801,BOMBA 2 FLUÍDO HIDRÁULICO TURBINA,DESLIGADO,LIGADO,BAIXA,NÃO,NÃO,,,
I731EML4601,BOMBA 1 ÓLEO BYPASS BP,LIGADO,DESLIGADO,MEDIA,NÃO,NÃO,,,
I731EML4602,BOMBA 2 ÓLEO BYPASS BP,LIGADO,DESLIGADO,MEDIA,NÃO,NÃO,,,
I731EML4800,BOMBA 1 FLUÍDO HIDRÁULICO TURBINA,LIGADO,DESLIGADO,MEDIA,NÃO,NÃO,,,
I731EML4801,BOMBA 2 FLUÍDO HIDRÁULICO TURBINA,LIGADO,DESLIGADO,MEDIA,NÃO,NÃO,,,
I731EMS4800,BBA 1 FLUÍDO HIDR TURB - PARTIDA STANDBY,ATUADO,NORMALIZADO,MEDIA,SIM,NÃO,,,
I731EMS4801,BBA 2 FLUÍDO HIDR TURB - PARTIDA STANDBY,ATUADO,NORMALIZADO,MEDIA,SIM,NÃO,,,
I731EMT4601,UNIDADE HIDR BY-PASS LE TURBINA BP,TRIP ELÉTRICO,NORMALIZADO,MEDIA,SIM,NÃO,,,
I731EMT4602,UNIDADE HIDR BY-PASS LD TURBINA BP,TRIP ELÉTRICO,NORMALIZADO,MEDIA,SIM,NÃO,,,
I731EMT4800,BOMBA 1 FLUÍDO HIDRÁULICO TURBINA,TRIP ELÉTRICO,NORMALIZADO,MEDIA,SIM,NÃO,,,
I731EMT4801,BOMBA 2 FLUÍDO HIDRÁULICO TURBINA,TRIP ELÉTRICO,NORMALIZADO,MEDIA,SIM,NÃO,,,
I731EVS4900D,VV SOL TESTE SOBREVELOCIDADE TURBINA,DESENERGIZADA/NORMAL,ENERGIZADA/ POS TESTE,BAIXA,NÃO,NÃO,,,
I731EVS4900L,VV SOL TESTE SOBREVELOCIDADE TURBINA,ENERGIZADA/ POS TESTE,DESENERGIZADA/NORMAL,ALTA,SIM,NÃO,,,
I731EVS4901D,VV SOL REARME TURBINA,DESENERGIZADA/NORMAL,ENERGIZADA/REARMAR,BAIXA,NÃO,NÃO,,,
I731EVS4901L,VV SOL REARME TURBINA,ENERGIZADA/REARMAR,DESENERGIZADA/NORMAL,ALTA,SIM,NÃO,,,
I731EVS4903D,VV SOL TRIP MECÂNICO TURBINA,DESENERGIZADA/NORMAL,ENERGIZADA/TRIP,BAIXA,NÃO,NÃO,,,
I731EVS4903L,VV SOL TRIP MECÂNICO TURBINA,ENERGIZADA/TRIP,DESENERGIZADA/NORMAL,ALTA,SIM,NÃO,,,
I731EVS4904D,VV SOL BLOQUEIO TRIP MECANICO TURBINA (LOCKOUT),DESENERGIZADA/NORMAL,ENERGIZADA/POS TESTE,BAIXA,NÃO,SIM,,,
I731EVS4904L,VV SOL BLOQUEIO TRIP MECANICO TURBINA (LOCKOUT),ENERGIZADA/POS TESTE,DESENERGIZADA/NORMAL,ALTA,SIM,SIM,,,
I731EVS4905D,VV SOL 1 RELÉ PRINCIPAL TRIP TURBINA,DESENERGIZADA/TRIP,ENERGIZADA/NORMAL,ALTA,SIM,NÃO,,,
I731EVS4905L,VV SOL 1 RELÉ PRINCIPAL TRIP TURBINA,ENERGIZADA/NORMAL,DESENERGIZADA/TRIP,ALTA,NÃO,NÃO,,,
I731EVS4906D,VV SOL 2 RELÉ PRINCIPAL TRIP TURBINA,DESENERGIZADA/TRIP,ENERGIZADA/NORMAL,ALTA,SIM,NÃO,,,
I731EVS4906L,VV SOL 2 RELÉ PRINCIPAL TRIP TURBINA,ENERGIZADA/NORMAL,DESENERGIZADA/TRIP,ALTA,NÃO,NÃO,,,
I731FH3005,VAZÃO TOTAL VAPOR SH SAÍDA CALDEIRA,ALTO,NORMALIZADO,MEDIA,NÃO,NÃO,,,
I731LH4600,NÍVEL COLETOR DRENOS LINHA RH FRIO LE,ALTO,NORMALIZADO,MEDIA,SIM,NÃO,,,
I731LH4601,NÍVEL COLETOR DRENOS LINHA RH FRIO LD,ALTO,NORMALIZADO,MEDIA,SIM,NÃO,,,
I731LH4801,NÍVEL TANQUE FLUÍDO HIDRÁULICO TURBINA,ALTO,NORMALIZADO,MEDIA,SIM,NÃO,,,
I731LHH4803,NÍVEL TANQUE FLUÍDO HIDRÁULICO TURBINA,MUITO ALTO,NORMALIZADO,MEDIA,SIM,NÃO,,,
I731LL4602,NÍVEL TANQUE UNID HIDR 1 BY-PASS BP,BAIXO,NORMALIZADO,MEDIA,SIM,NÃO,,,
I731LL4612,NÍVEL TANQUE UNID HIDR 2 BY-PASS BP,BAIXO,NORMALIZADO,MEDIA,SIM,NÃO,,,
I731LL4802,NÍVEL TANQUE FLUÍDO HIDRÁULICO TURBINA,BAIXO,NORMALIZADO,MEDIA,SIM,NÃO,,,
I731LLL4804,NÍVEL TANQUE FLUÍDO HIDRÁULICO TURBINA,MUITO BAIXO,NORMALIZADO,MEDIA,SIM,NÃO,,,
I731PB3001,TRIP BYPASS BP,ATUADO,NORMALIZADO,ALTA,SIM,SIM,,,
I731PB3001A,BOTÃO TRIP TURBINA - SALA COMADO,ATUADO,NORMALIZADO,ALTA,SIM,NÃO,,,
I731PB3002,BOTÃO REARME TURBINA - SALA COMANDO,ATUADO,NORMALIZADO,ALTA,SIM,NÃO,,,
I731PH3003,PRESS VAPOR SH SAÍDA CALDEIRA LD (PSH3003/3004/3005),ALTO,NORMALIZADO,ALTA,SIM,NÃO,,,
I731PH3010A,PRESS VAPOR SH SAÍDA CALDEIRA LD,ALTO,NORMALIZADO,MEDIA,SIM,NÃO,,,
I731PH3016,PRESSÃO VAPOR SH ENTR TURBINA AP,ALTO,NORMALIZADO,MEDIA,SIM,NÃO,,,
I731PH3062,PRESSÃO VAPOR RH QUENTE ENTR TURBINA MP,ALTO,NORMALIZADO,MEDIA,SIM,NÃO,,,
I731PH3601,PRESSÃO VAPOR BY-PASS BP LE ENTRADA CONDENSADOR,ALTO,NORMALIZADO,ALTA,SIM,NÃO,,,
I731PH3611,PRESSÃO VAPOR BY-PASS BP LD ENTRADA CONDENSADOR,ALTO,NORMALIZADO,ALTA,SIM,NÃO,, ,
I731PH4603,PRESSÃO UNIDADE HIDRÁULICA BY-PASS BP,ALTO,NORMALIZADO,MEDIA,SIM,NÃO,,,
I731PHH4613,PRESSÃO UNIDADE HIDRÁULICA BY-PASS BP,MUITO ALTO,NORMALIZADO,MEDIA,SIM,NÃO,,,
I731PL4811,PRESSÃO FLUÍDO HIDRÁULICO TURBINA,BAIXO,NORMALIZADO,MEDIA,SIM,NÃO,,,
I731PL4900,TURBINA BLOQUEADA - PRES ÓLEO TRIP,BAIXO,NORMALIZADO,ALTA,SIM,NÃO,,,
I731PLL4602,PRES UNIDADE HIDRÁULICA BY-PASS BP,MUITO BAIXO,NORMALIZADO,ALTA,SIM,NÃO,,,
I731PLL4812,PRESSÃO FLUÍDO HIDRÁULICO TURBINA (LOGICA 2 DE 3),MUITO BAIXO,NORMALIZADO,ALTA,SIM,NÃO,,,
I731ROP1001,RUNBACK EM OPERAÇÃO,ATUADO,NORMALIZADO,ALTA,SIM,NÃO,,,
I731TCM1001,TURBINA CONTROLANDO MW ,PRESENTE,AUSENTE,ALTA,NÃO,NÃO,,,
I731TCP1001,TURBINA CONTROLANDO PRESSÃO,PRESENTE,AUSENTE,ALTA,NÃO,NÃO,,,
I731TH3005,TEMP VAPOR SH SAÍDA CALDEIRA LE,ALTO,NORMALIZADO,MEDIA,SIM,NÃO,,,
I731TH3011,TEMP VAPOR SH SAÍDA CALDEIRA LD,ALTO,NORMALIZADO,MEDIA,SIM,NÃO,,,
I731TH3031,TEMP VAPOR APÓS BY-PASS AP LADO ESQ,ALTO,NORMALIZADO,MEDIA,SIM,NÃO,,,
I731TH3035,TEMP VAPOR APÓS BY-PASS AP LADO DIR,ALTO,NORMALIZADO,MEDIA,SIM,NÃO,,,
I731TH3054,TEMP VAPOR RH QUENTE SAÍDA CALDEIRA LE,ALTO,NORMALIZADO,MEDIA,SIM,NÃO,,,
I731TH3060,TEMP VAPOR RH QUENTE SAÍDA CALDEIRA LD,ALTO,NORMALIZADO,MEDIA,SIM,NÃO,,,
I731TH3600,TEMP VAPOR BY-PASS BP LE ANTES ATEMP AUX,ALTO,NORMALIZADO,MEDIA,SIM,NÃO,,,
I731TH3610,TEMP VAPOR BY-PASS BP LD ANTES ATEMP AUX,ALTO,NORMALIZADO,MEDIA,SIM,NÃO,,,
I731TH4603,TEMP TANQUE UNID HIDR 1 BY-PASS BP,ALTO,NORMALIZADO,MEDIA,SIM,NÃO,,,
I731TH4613,TEMP TANQUE UNID HIDR 2 BY-PASS BP,ALTO,NORMALIZADO,MEDIA,SIM,NÃO,,,
I731TH4800,TEMP FLUÍDO HIDRÁULICO TURBINA (TANQUE),ALTO,NORMALIZADO,MEDIA,SIM,NÃO,,,
I731THH3601,TEMP VAPOR BY-PASS BP LE ANTES ATEMP AUX,MUITO ALTO,NORMALIZADO,ALTA,SIM,NÃO,,,
I731THH3602,TEMP VAPOR BY-PASS BP LE ANTES ATEMP AUX,MUITO ALTO,NORMALIZADO,ALTA,SIM,NÃO,,,
I731THH3611,TEMP VAPOR BY-PASS BP LD ANTES ATEMP AUX,MUITO ALTO,NORMALIZADO,ALTA,SIM,NÃO,,,
I731THH3612,TEMP VAPOR BY-PASS BP LD ANTES ATEMP AUX,MUITO ALTO,NORMALIZADO,ALTA,SIM,NÃO,,,
I731U001XV05,TURBINA,BLOQUEADA,REARMADA,ALTA,SIM,NÃO,,,
I731U012XV01,BY-PASS BP - MODO PARTIDA UNID SEM VÁCUO,ATUADO,NORMALIZADO,MEDIA,NÃO,NÃO,,,
I731U012XV02,BY-PASS BP - RESET PARTIDA UNID,ATUADO,NORMALIZADO,MEDIA,NÃO,NÃO,,,
I731U012XV03,BY-PASS BP - MODO PARTIDA UNID COM VÁCUO,ATUADO,NORMALIZADO,MEDIA,NÃO,NÃO,,,
I731ZH4010,VÁLV. BLOWN-DOWN ABERTA,ABERTA,NÃO ABERTA,ALTA,SIM,NÃO,,,
I731ZH4053,VV FLUXO REVERSO TURBINA AP LE,ABERTA,NÃO ABERTA,ALTA,SIM,NÃO,,,
I731ZH4063,VV FLUXO REVERSO TURBINA AP LD,ABERTA,NÃO ABERTA,ALTA,SIM,NÃO,,,
I731ZH4601,VALVULA BLOQUEIO BY-PASS PB LE,NÃO ABERTA,ABERTA,MEDIA,SIM,SIM,,,
I731ZH4611,VALVULA BLOQUEIO BY-PASS PB LD,NÃO ABERTA,ABERTA,MEDIA,SIM,SIM,,,
I731ZL4009,VÁLV. BLOWN-DOWN FECHADA ,NÃO FECHADA,FECHADA,MEDIA,SIM,SIM,,,
I731ZL4054,VV FLUXO REVERSO TURBINA AP LE,NÃO FECHADA,FECHADA,MEDIA,SIM,SIM,,,
I731ZL4064,VV FLUXO REVERSO TURBINA AP LD,NÃO FECHADA,FECHADA,MEDIA,SIM,SIM,,,
I731ZL4603,BY-PASS BAIXA PRESSÃO LE (PCV4601),FECHADA,NÃO FECHADA,MEDIA,NÃO,NÃO, ,,
I731ZL4604,VALVULA BLOQUEIO BY-PASS PB LE,FECHADA,NÃO FECHADA,ALTA,SIM,NÃO,,,
I731ZL4613,BY-PASS BAIXA PRESSÃO LD (PCV4602),FECHADA,NÃO FECHADA,MEDIA,NÃO,NÃO,,,
I731ZL4614,VALVULA BLOQUEIO BY-PASS PB LD,FECHADA,NÃO FECHADA,ALTA,SIM,NÃO,,,
I731ZL4902,RELE TRIP MECANICO,ATUADO,NÃO ATUADO,ALTA,SIM,NÃO,,,
I731ZM2087,VÁLVULA VENTILAÇÃO TURBINA (BPVV),ABERTA,NÃO ABERTA,ALTA,SIM,NÃO,,,
I731ZM2088,VÁLVULA VENTILAÇÃO TURBINA (BPVV),NÃO FECHADA,FECHADA,ALTA,SIM,SIM,,,
I731ZS4900,PISTÃO RESET RELÉ TRIP MECÂNICO,ATUADO,NORMALIZADA,ALTA,SIM,SIM,,,
I731ZS4901,RELÉ TRIP MECÂNICO,ATUADO,NORMALIZADA,ALTA,SIM,NÃO,,,
I731ZS4903,VÁLVULA LOCK OUT,ATUADO,NORMALIZADA,ALTA,SIM,NÃO,,,
I731ZS4904,VÁLVULA 1 RELÉ PRINCIPAL TRIP TURBINA,NORMAL,TRIP,ALTA,SIM,SIM,,,
I731ZS4905,VÁLVULA 2 RELÉ PRINCIPAL TRIP TURBINA,NORMAL,TRIP,ALTA,SIM,SIM,,,
I733PH4002,ATEMPERAÇÃO EXAUSTÃO TURBINA BP,OPERANDO,NORMALIZADA,ALTA,SIM,NÃO,,,
I733THH4003,TEMP EXAUSTÃO TURBINA BP,MUITO ALTA,NORMALIZADA,MEDIA,SIM,NÃO,,,
I733TVH4004,TEMP EXAUSTÃO TURBINA BP (LOGICA 2 DE 3),ALTISSIMA,NORMALIZADA,ALTA,SIM,NÃO,,,
I734EMD4001,EXAUSTOR TANQUE ÓLEO LUB TURBINA,DESLIGADO,LIGADO,MEDIA,NÃO,NÃO,,,
I734EMD4003,BOMBA AUXILIAR ÓLEO TURBINA,DESLIGADO,LIGADO,BAIXA,NÃO,NÃO,,,
I734EMD4004,BOMBA ÓLEO VIRADOR TURBINA,DESLIGADO,LIGADO,BAIXA,NÃO,NÃO,,,
I734EMD4005,BOMBA EMERGÊNCIA ÓLEO TURBINA,DESLIGADO,LIGADO,BAIXA,NÃO,NÃO,,,
I734EMD4100,VIRADOR TURBINA,DESLIGADO,LIGADO,BAIXA,NÃO,NÃO,,,
I734EML4001,EXAUSTOR TANQUE ÓLEO LUB TURBINA,LIGADO,DESLIGADO,ALTA,NÃO,NÃO,,,
I734EML4003,BOMBA AUXILIAR ÓLEO TURBINA,LIGADO,DESLIGADO,ALTA,NÃO,NÃO,,,
I734EML4004,BOMBA ÓLEO VIRADOR TURBINA,LIGADO,DESLIGADO,ALTA,NÃO,NÃO,,,
I734EML4005,BOMBA EMERGÊNCIA ÓLEO TURBINA,LIGADO,DESLIGADO,ALTA,NÃO,NÃO,,,
I734EML4100,VIRADOR TURBINA,LIGADO,DESLIGADO,ALTA,NÃO,NÃO,,,
I734EMT4003,BOMBA AUXILIAR ÓLEO TURBINA,TRIP ELÉTRICO,NORMALIZADO,ALTA,SIM,NÃO,,,
I734EMT4004,BOMBA ÓLEO VIRADOR TURBINA,TRIP ELÉTRICO,NORMALIZADO,ALTA,SIM,NÃO,,,
I734EMT4005A,BOMBA EMERGÊNCIA ÓLEO TURBINA,TRIP ELÉTRICO,NORMALIZADO,ALTA,SIM,NÃO,,,
I734EMT4100,VIRADOR TURBINA,TRIP ELÉTRICO,NORMALIZADO,ALTA,SIM,NÃO,,,
I734EMX4601,OPERAÇÃO UNID HIDR 1 BY-PASS BP,TEMPO EXCEDIDO,NORMALIZADO,MEDIA,SIM,NÃO,,,
I734EMX4602,OPERAÇÃO UNID HIDR 2 BY-PASS BP,TEMPO EXCEDIDO,NORMALIZADO,MEDIA,SIM,NÃO,,,
I734EVS4100D,VVA SOL ENGATE VIRADOR TURBINA,DESENERGIZADA,ENERGIZADA,MEDIA,NÃO,NÃO,,,
I734EVS4100L,VVA SOL ENGATE VIRADOR TURBINA,ENERGIZADA,DESENERGIZADA,MEDIA,NÃO,NÃO,,,
I734LH4002,NÍVEL TANQUE ÓLEO LUBRIFICAÇÃO TURBINA,ALTO,NORMALIZADO,MEDIA,SIM,NÃO,,,
I734LL4003,NÍVEL TANQUE ÓLEO LUBRIFICAÇÃO TURBINA,BAIXO,NORMALIZADO,MEDIA,SIM,NÃO,,,
I734MBB4005,BBA EMERG ÓLEO TURBINA,INDISPONÍVEL,NORMALIZADO,MEDIA,SIM,NÃO,,,
I734PH4020,BBA EMERG ÓLEO TURBINA,OPERANDO,PARADA,ALTA,SIM,NÃO,,,
I734PL4008,PRES ÓLEO LUBRIFICAÇÃO TURBINA,BAIXO,NORMALIZADO,ALTA,SIM,NÃO,,,
I734PLL4011,PRES ÓLEO LUBRIFICAÇÃO TURBINA,MUITO BAIXO,NORMALIZADO,ALTA,SIM,NÃO,,,
I734SH4001,ROTOR TURBINA PARADO OU GIRO LENTO LIGADO E DESENGATADO,PRESENTE,NORMALIZADO,ALTA,SIM,NÃO,,,
I734SL4001,VELO TURB < 3 RPM E VIRADOR DESENGATADO,,,,,,,,
I734TH3107,TEMP METAL SUP MANCAL ESCORA L ATIVO,ALTO,NORMALIZADO,MEDIA,SIM,NÃO,,,
I734TH3109,TEMP METAL SUP MANCAL ESCORA L ATIVO,ALTO,NORMALIZADO,MEDIA,SIM,NÃO,,,
I734TH3111,TEMP METAL INF MANCAL ESCORA L ATIVO,ALTO,NORMALIZADO,MEDIA,SIM,NÃO,,,
I734TH3113,TEMP METAL INF MANCAL ESCORA L ATIVO,ALTO,NORMALIZADO,MEDIA,SIM,NÃO,,,
I734TH3115,TEMP METAL SUP MANCAL ESCORA L INATIVO,ALTO,NORMALIZADO,MEDIA,SIM,NÃO,,,
I734TH3117,TEMP METAL SUP MANCAL ESCORA L INATIVO,ALTO,NORMALIZADO,MEDIA,SIM,NÃO,,,
I734TH3119,TEMP METAL MANCAL 1 TURBINA,ALTO,NORMALIZADO,MEDIA,SIM,NÃO,,,
I734TH3121,TEMP METAL MANCAL 1 TURBINA,ALTO,NORMALIZADO,MEDIA,SIM,NÃO,,,
I734TH3123,TEMP METAL MANCAL 2 TURBINA,ALTO,NORMALIZADO,MEDIA,SIM,NÃO,,,
I734TH3125,TEMP METAL MANCAL 2 TURBINA,ALTO,NORMALIZADO,MEDIA,SIM,NÃO,,,
I734TH3127,TEMP METAL MANCAL 3 TURBINA,ALTO,NORMALIZADO,MEDIA,SIM,NÃO,,,
I734TH3129,TEMP METAL MANCAL 4 TURBINA,ALTO,NORMALIZADO,MEDIA,SIM,NÃO,,,
I734TH3131,TEMP ÓLEO MANCAL ESCORA TURB L ATIVO,ALTO,NORMALIZADO,MEDIA,SIM,NÃO,,,
I734TH3133,TEMP ÓLEO MANCAL ESCORA TURB L INATIVO,ALTO,NORMALIZADO,MEDIA,SIM,NÃO,,,
I734TH3135,TEMP ÓLEO DESC MANCAL 1 TURBINA,ALTO,NORMALIZADO,MEDIA,SIM,NÃO,,,
I734TH3137,TEMP ÓLEO DESC MANCAL 2 TURBINA,ALTO,NORMALIZADO,MEDIA,SIM,NÃO,,,
I734TH3139,TEMP ÓLEO DESC MANCAL 3 TURBINA,ALTO,NORMALIZADO,MEDIA,SIM,NÃO,,,
I734TH3141,TEMP ÓLEO DESC MANCAL 4 TURBINA,ALTO,NORMALIZADO,MEDIA,SIM,NÃO,,,
I734TH4005,TEMP ÓLEO LUB TURBINA SAÍDA RESFRIADORES,ALTO,NORMALIZADO,MEDIA,SIM,NÃO,,,
I734ZH4101,VIRADOR TURBINA,ENGATADO,NÃO ATUADO,ALTA,SIM,NÃO,,,
I734ZL4100,VIRADOR TURBINA,DESENGATADO,NÃO ATUADO,ALTA,NÃO,NÃO,,,
I735LH3006,NÍVEL CONDENSADOR,ALTO,NORMALIZADO,MEDIA,SIM,NÃO,,,
I735LHH3003,NÍVEL CONDENSADOR,MUITO ALTO,NORMALIZADO,ALTA,SIM,NÃO,,,
I735LL3004,NÍVEL CONDENSADOR,BAIXO,NORMALIZADO,MEDIA,SIM,NÃO,,,
I735LLL3005,NÍVEL CONDENSADOR,MUITO BAIXO,NORMALIZADO,ALTA,SIM,NÃO,,,
I735PH3002,PRESSÃO ABSOLUTA CONDENSADOR,ALTO,NORMALIZADO,MEDIA,SIM,NÃO,,,
I735PHH3008,PRESSÃO ABSOLUTA CONDENSADOR (LOGICA 2 DE 3),MUITO ALTO,NORMALIZADO,ALTA,SIM,NÃO,,,
I735PVH3004,PRESSÃO ABSOLUTA CONDENSADOR,ALTISSIMA,NORMALIZADO,MEDIA,SIM,NÃO,,,
I735PVH3005,PRESSÃO ABSOLUTA CONDENSADOR,ALTISSIMA,NORMALIZADO,MEDIA,SIM,NÃO,,,
I735YH4001,SISTEMA LIMPEZA CONDENSADOR,FALHA,NORMALIZADO,MEDIA,SIM,NÃO,,,
I736ESM1001,BOTÃO ABERTURA VVA QUEBRA VÁCUO COND,ATUADO,NORMALIZADO,MEDIA,SIM,NÃO,,,
I736LH4201,NÍVEL CONDENSADOR VAPOR EJETORES 1,ALTO,NORMALIZADO,MEDIA,SIM,NÃO,,,
I736LH4203,NÍVEL CONDENSADOR VAPOR EJETORES 2,ALTO,NORMALIZADO,MEDIA,SIM,NÃO,,,
I737EMD4001,EXAUSTOR 1 CVS,DESLIGADO,LIGADO,BAIXA,NÃO,NÃO,,,
I737EMD4002,EXAUSTOR 2 CVS,DESLIGADO,LIGADO,BAIXA,NÃO,NÃO,,,
I737EML4001,EXAUSTOR 1 CVS,LIGADO,DESLIGADO,MEDIA,NÃO,NÃO,,,
I737EML4002,EXAUSTOR 2 CVS,LIGADO,DESLIGADO,MEDIA,NÃO,NÃO,,,
I737EMT4001,EXAUSTOR 1 CVS,TRIP ELÉTRICO,NORMALIZADO,ALTA,SIM,NÃO,,,
I737EMT4002,EXAUSTOR 2 CVS,TRIP ELÉTRICO,NORMALIZADO,ALTA,SIM,NÃO,,,
I737LH4001,NÍVEL CONDENSADOR VAPOR SELAGEM,ALTO,NORMALIZADO,MEDIA,SIM,NÃO,,,
I737MEX4001S,EXAUSTOR 1 CVS PARTIDA STAND BY,ATUADO,NORMALIZADO,MEDIA,SIM,NÃO,,,
I737MEX4002S,EXAUSTOR 2 CVS PARTIDA STAND BY,ATUADO,NORMALIZADO,MEDIA,SIM,NÃO,,,
I737PL4001,PRESSÃO VAPOR SELAGEM TURBINA,BAIXO,NORMALIZADO,MEDIA,SIM,NÃO,,,
I737TH3002,TEMP VAPOR SELAGEM TURBINA,ALTO,NORMALIZADO,MEDIA,SIM,NÃO,,,
I742DPH3023,PRES DIF FILTRO ADM 2º EST BBA COND 2,ALTO,NORMALIZADO,MEDIA,SIM,NÃO,,,
I742DPH3025,PRES DIF FILTRO ADM 2º EST BBA COND 1,ALTO,NORMALIZADO,MEDIA,SIM,NÃO,,,
I742DPL3011,PRES DIF COND E/S RESFR H2/ ÁGUA ESTATOR,BAIXO,NORMALIZADO,MEDIA,SIM,NÃO,,,
I742DTH3032,TEMP DIF PIST BAL/SUCÇÃO 2º EST BBA COND 1,ALTO,NORMALIZADO,MEDIA,SIM,NÃO,,,
I742DTH3033,TEMP DIF PIST BAL/SUCÇÃO 2º EST BBA COND 2,ALTO,NORMALIZADO,MEDIA,SIM,NÃO,,,
I742EMD1001,BOMBA CONDENSADO 1,DESLIGADO,LIGADO,BAIXA,NÃO,NÃO,,,
I742EMD1002,BOMBA CONDENSADO 2,DESLIGADO,LIGADO,BAIXA,NÃO,NÃO,,,
I742EML1001,BOMBA CONDENSADO 1,LIGADO,DESLIGADO,MEDIA,NÃO,NÃO,,,
I742EML1002,BOMBA CONDENSADO 2,LIGADO,DESLIGADO,MEDIA,NÃO,NÃO,,,
I742EMS1001,BOMBA CONDENSADO 1 - PARTIDA STANDBY,ATUADO,NORMALIZADO,ALTA,SIM,NÃO,,,
I742EMS1002,BOMBA CONDENSADO 2 - PARTIDA STANDBY,ATUADO,NORMALIZADO,ALTA,SIM,NÃO,,,
I742EMT1001,BOMBA CONDENSADO 1,TRIP ELÉTRICO,NORMALIZADO,ALTA,SIM,NÃO,,,
I742EMT1002,BOMBA CONDENSADO 2,TRIP ELÉTRICO,NORMALIZADO,ALTA,SIM,NÃO,,,
I742ESM3005,POLIDORA 1 - ISOLADO PARA MANUTENÇÃO,PRESENTE,AUSENTE,BAIXA,NÃO,NÃO,,,
I742ESM3005A,VVA BY-PASS POLIDORA,ABERTA,NÃO ABERTA,ALTA,SIM,NÃO,,,
I742FL1003,VAZÃO ÁGUA RESFR MANCAL ESC BBA COND 1,BAIXO,NORMALIZADO,MEDIA,SIM,NÃO,,,
I742FL1004,VAZÃO ÁGUA RESFR MANCAL ESC BBA COND 2,BAIXO,NORMALIZADO,MEDIA,SIM,NÃO,,,
I742FL3002,VAZÃO CONDENSADO BAIXA PRESSÃO,BAIXO,NORMALIZADO,MEDIA,SIM,NÃO,,,
I742FVL3001,VAZÃO CONDENSADO BAIXA PRESSÃO,MUITO BAIXA,NORMALIZADO,ALTA,SIM,NÃO,,,
I742FVL3002,VAZÃO CONDENSADO BAIXA PRESSÃO,MUITO BAIXA,NORMALIZADO,ALTA,SIM,NÃO,,,
I742LL1003,NÍVEL ÓLEO MANCAL ESCORA BB CONDENSADO 1,BAIXO,NORMALIZADO,MEDIA,SIM,NÃO,,,
I742LL1004,NÍVEL ÓLEO MANCAL ESCORA BB CONDENSADO 2,BAIXO,NORMALIZADO,MEDIA,SIM,NÃO,,,
I742MBB1002,COMANDO FECHAR VVA DESC BBAS CONDENSADO,ATUADO,NÃO ATUADO,MEDIA,SIM,NÃO,,,
I742PH3031,PRES DESC PISTÃO BALANÇO BB CONDENSADO 1,ALTO,NORMALIZADO,MEDIA,SIM,NÃO,,,
I742PH3032,PRES DESC PISTÃO BALANÇO BB CONDENSADO 2,ALTO,NORMALIZADO,MEDIA,SIM,NÃO,,,
I742PL3021,PRES ADMISSÃO 2º ESTÁGIO BBAS CONDENSADO,BAIXO,NORMALIZADO,MEDIA,SIM,NÃO,,,
I742PL5001,BBA CONDENSADO 1 - VAZAM ÁGUA RESF MOT,, ,,,,,,
I742PL5002,BBA CONDENSADO 2 - VAZAM ÁGUA RESF MOT,,,,,,,,
I742PLL3022A,PRES ADMISSÃO 2º ESTÁGIO BBAS CONDENSADO,MUITO BAIXO,NORMALIZADO,ALTA,SIM,NÃO,,,
I742PLL3022B,PRES ADMISSÃO 2º ESTÁGIO BBAS CONDENSADO,MUITO BAIXO,NORMALIZADO,ALTA,SIM,NÃO,,,
I742TH3001,TEMP COND ENTRADA POLIDORAS,ALTO,NORMALIZADO,MEDIA,SIM,NÃO,,,
I742TH3005,TEMP COND ENTR RESFR H2/ÁGUA ESTATOR,ALTO,NORMALIZADO,MEDIA,SIM,NÃO,,,
I742TH3036,TEMP MANCAL ESCORA BBA CONDENSADO 1,ALTO,NORMALIZADO,MEDIA,SIM,NÃO,,,
I742TH3038,TEMP MANCAL ESCORA BBA CONDENSADO 2,ALTO,NORMALIZADO,MEDIA,SIM,NÃO,,,
I742TH3040,TEMP MANCAIS MOTOR BBA CONDENSADO 1,ALTO,NORMALIZADO,MEDIA,SIM,NÃO,,,
I742TH3042,TEMP MANCAIS MOTOR BBA CONDENSADO 2,ALTO,NORMALIZADO,MEDIA,SIM,NÃO,,,
I742TH3044,TEMP ENROL MOTOR BBA CONDENSADO 1,ALTO,NORMALIZADO,MEDIA,SIM,NÃO,,,
I742TH3045,TEMP ENROL MOTOR BBA CONDENSADO 2,ALTO,NORMALIZADO,MEDIA,SIM,NÃO,,,
I742THH3036,TEMP MANCAL ESCORA BBA CONDENSADO 1,MUITO ALTO,NORMALIZADO,ALTA,SIM,NÃO,,,
I742THH3038,TEMP MANCAL ESCORA BBA CONDENSADO 2,MUITO ALTO,NORMALIZADO,ALTA,SIM,NÃO,,,
I742THH3040,TEMP MANCAL INF MOTOR BBA CONDENSADO 1,MUITO ALTO,NORMALIZADO,ALTA,SIM,NÃO,,,
I742THH3042,TEMP MANCAL INF MOTOR BBA CONDENSADO 2,MUITO ALTO,NORMALIZADO,ALTA,SIM,NÃO,,,
I742THH3046,TEMP MANCAL SUP MOTOR BBA CONDENSADO 1,MUITO ALTO,NORMALIZADO,ALTA,SIM,NÃO,,,
I742THH3048,TEMP MANCAL SUP MOTOR BBA CONDENSADO 2,MUITO ALTO,NORMALIZADO,ALTA,SIM,NÃO,,,
I742ZH1001,VVA DESC 1º ESTÁGIO BB CONDENSADO 1,ABERTA,NÃO ABERTA,MEDIA,NÃO,NÃO,,,
I742ZH1002,VVA DESC 1º ESTÁGIO BB CONDENSADO 2,ABERTA,NÃO ABERTA,MEDIA,NÃO,NÃO,,,
I742ZH1011,VVA ADM 1º ESTÁGIO BBA CONDENSADO 1,ABERTA,NÃO ABERTA,MEDIA,NÃO,NÃO,,,
I742ZH1012,VVA ADM 1º ESTÁGIO BBA CONDENSADO 2,ABERTA,NÃO ABERTA,MEDIA,NÃO,NÃO,,,
I742ZL3005,VVA BY-PASS POLIDORA,FECHADA,NÃO FECHADA,MEDIA,NÃO,NÃO,,,
I742ZM1001,VVA DESC 1º ESTÁGIO BBA CONDENSADO 1,NÃO ABERTA,NORMALIZADO,MEDIA,SIM,NÃO,,,
I742ZM1002,VVA DESC 1º ESTÁGIO BBA CONDENSADO 2,NÃO ABERTA,NORMALIZADO,MEDIA,SIM,NÃO,,,
I742ZM1011,VVA ADM 1º ESTÁGIO BBA CONDENSADO 1,NÃO ABERTA,NORMALIZADO,MEDIA,SIM,NÃO,,,
I742ZM1012,VVA ADM 1º ESTÁGIO BBA CONDENSADO 2,NÃO ABERTA,NORMALIZADO,MEDIA,SIM,NÃO,,,
I744AH5001NA,SÓDIO CONDENSADO SAÍDA POLIDORA,ALTO,NORMALIZADO,MEDIA,SIM,NÃO,,,
I744AH5001SI,SILICA CONDENSADO SAÍDA POLIDORA,,,,,,,,
I744DPH5003,PRESSÃO DIFERENCIAL POLIDORA,ALTO,NORMALIZADO,MEDIA,SIM,NÃO,,,
I744DPH5004,PRESSÃO DIFERENCIAL POLIDORA 1,ALTO,NORMALIZADO,MEDIA,SIM,NÃO,,,
I744DPH5005,PRESSÃO DIFERENCIAL POLIDORA 2,ALTO,NORMALIZADO,MEDIA,SIM,NÃO,,,
I744DPH5006,PRESSÃO DIFER FILTRO RESINA POLIDORA 1,ALTO,NORMALIZADO,MEDIA,SIM,NÃO,,,
I744DPH5007,PRESSÃO DIFER FILTRO RESINA POLIDORA 2,ALTO,NORMALIZADO,MEDIA,SIM,NÃO,,,
I744DPHH5004,PRESSÃO DIFERENCIAL POLIDORA 1,MUITO ALTO,NORMALIZADO,MEDIA,SIM,NÃO,,,
I744DPHH5005,PRESSÃO DIFERENCIAL POLIDORA 2,MUITO ALTO,NORMALIZADO,MEDIA,SIM,NÃO,,,
I744EMD5001,BOMBA 1 RECIRCULAÇÃO POLIDORA,DESLIGADO,LIGADO,BAIXA,NÃO,NÃO,,,
I744EMD5002,BOMBA 2 RECIRCULAÇÃO POLIDORA,DESLIGADO,LIGADO,BAIXA,NÃO,NÃO,,,
I744EML5001,BOMBA 1 RECIRCULAÇÃO POLIDORA,LIGADO,DESLIGADO,BAIXA,NÃO,NÃO,,,
I744EML5002,BOMBA 2 RECIRCULAÇÃO POLIDORA,LIGADO,DESLIGADO,BAIXA,NÃO,NÃO,,,
I744ESM3005,POLIDORA 2 - ISOLADO PARA MANUTENÇÃO,PRESENTE,AUSENTE,BAIXA,NÃO,NÃO,,,
I744FL5002,VAZÃO CONDENSADO POLIDORA 1,BAIXO,NORMALIZADO,BAIXA,NÃO,NÃO,,,
I744FQH5002,POLIDORA 1 - QUANTIDADE COND TRATADO,ALTO,NORMALIZADO,BAIXA,NÃO,NÃO,,,
I744FQH5003,POLIDORA 2 - QUANTIDADE COND TRATADO,ALTO,NORMALIZADO,BAIXA,NÃO,NÃO,,,
I744TRIP0001,SISTEMA POLIMENTO CONDENSADO,FALHA,NORMALIZADO,BAIXA,NÃO,NÃO,,,
I744U001XA15,POLIDORA 1 BOTÃO PARTIDA MESA COMANDO,ATUADO,NORMALIZADO,BAIXA,NÃO,NÃO,,,
I744U001XU04,POLIDORA 1,OPER,NORMALIZADO,BAIXA,NÃO,NÃO,,,
I744U001XU06,FALHA NA PARTIDA AUTOMATICA POLIDORA 2,ATUADO,NORMALIZADO,BAIXA,NÃO,NÃO,,,
I744U001XU09,POLIDORA 1,NOPE,NORMALIZADO,BAIXA,NÃO,NÃO,,,
I744U001XV05,POLIDORA 1 EXAURIDA,ATUADO,NORMALIZADO,BAIXA,NÃO,NÃO,,,
I744U001YA16,POLIDORA 1 - PARADA MANUAL MESA COMANDO,ATUADO,NORMALIZADO,BAIXA,NÃO,NÃO,,,
I744U002XA15,POLIDORA 2 BOTÃO PARTIDA MESA COMANDO,ATUADO,NORMALIZADO,BAIXA,NÃO,NÃO,,,
I744U002XU03,POLIDORA 1 - CORREÇÃO PRESSÃO OPCP,FALHA,NORMALIZADO,BAIXA,NÃO,NÃO,,,
I744U002XU04,POLIDORA 1 - CORREÇÃO PRESSÃO OPCP,OPER,NORMALIZADO,BAIXA,NÃO,NÃO,,,
I744U003XU04,POLIDORA 2,OPER,NORMALIZADO,BAIXA,NÃO,NÃO,,,
I744U003XU05,POLIDORA 2  EXAURIDA,ATUADO,NORMALIZADO,BAIXA,NÃO,NÃO,,,
I744U003XU06,FALHA NA PARTIDA AUTOMATICA POLIDORA 1,ATUADO,NORMALIZADO,BAIXA,NÃO,NÃO,,,
I744U003XU09,POLIDORA 2,NOPE,NORMALIZADO,BAIXA,NÃO,NÃO,,,
I744U003YA16,POLIDORA 2 - PARADA MANUAL MESA COMANDO,ATUADO,NORMALIZADO,BAIXA,NÃO,NÃO,,,
I744U004XU03,POLIDORA 2 - CORREÇÃO PRESSÃO OPCP,FALHA,NORMALIZADO,BAIXA,NÃO,NÃO,,,
I744U004XU04,POLIDORA 2 - CORREÇÃO PRESSÃO OPCP,OPER,NORMALIZADO,BAIXA,NÃO,NÃO,,,
I744U201XV07,POLIDORA 1 - COMANDO TRANSF RESINA,ATUADO,NORMALIZADO,BAIXA,NÃO,NÃO,,,
I744U203XV01,POLIDORA 1 EXAURIDA (CONDUTIVIDADE ALTA),PRES,NORMALIZADO,BAIXA,NÃO,NÃO,,,
I744U203XV04,POLIDORA 2 EXAURIDA (CONDUTIVIDADE ALTA),PRES,NORMALIZADO,BAIXA,NÃO,NÃO,,,
I744U203XV06,VVA RECIRCULAÇÃO ENTRADA POLIDORA,VVNA,NORMALIZADO,BAIXA,NÃO,NÃO,,,
